{
  "$schema": "https://json-schema.org/draft/2020-12/schema",
  "$id": "https://scriptwidget.app/schemas/skill-1.0.json",
  "title": "ScriptWidget Skill 1.0",
  "type": "object",
  "additionalProperties": false,
  "required": [
    "formatVersion", "id", "name", "version", "summary", "symbol",
    "promptFile", "tags", "minimumRuntimeVersion"
  ],
  "properties": {
    "formatVersion": { "const": 1 },
    "id": { "type": "string", "pattern": "^[A-Za-z0-9][A-Za-z0-9.-]{2,127}$" },
    "name": { "type": "string", "minLength": 1, "maxLength": 80 },
    "version": { "type": "string", "pattern": "^[0-9]+\\.[0-9]+\\.[0-9]+(?:-[0-9A-Za-z.-]+)?$" },
    "summary": { "type": "string", "minLength": 1, "maxLength": 240 },
    "symbol": { "type": "string", "minLength": 1, "maxLength": 80 },
    "promptFile": { "const": "SKILL.md" },
    "tags": {
      "type": "array",
      "maxItems": 20,
      "uniqueItems": true,
      "items": { "type": "string" }
    },
    "author": { "type": "string" },
    "minimumRuntimeVersion": { "const": "1.0" }
  }
}
